{
  "schema_version": "run_manifest.v1",
  "run_id": "20260723-contract-smoke",
  "created_at": "2026-07-23T09:00:00+07:00",
  "code_commit": "fb8043b",
  "model_version": "contract-smoke-draft",
  "config_sha256": "aaaaaaaaaaaaaaaaaaaaaaaaaaaaaaaaaaaaaaaaaaaaaaaaaaaaaaaaaaaaaaaa",
  "dataset_id": "practice-dataset-v1",
  "processing_mode": "causal_online",
  "input_features": ["stereo_road_video", "telemetry"],
  "uses_future_frames": false,
  "uses_full_event_schedule": false,
  "depth_keyframe_policy": "validation_only",
  "hardware": {
    "platform": "contract-smoke-test",
    "accelerator": null
  },
  "contract_versions": {
    "perception": "perception.v1",
    "risk_event": "risk_event.v1"
  }
}
